{
  "cloud": "aws",
  "networks": {
    "test": {
      "cloud": "aws",
      "name": "coinops-test-network",
      "cidr": "10.40.0.0/16",
      "subnets": {
        "public": {
          "cidr": "10.40.1.0/24",
          "placement": "primary",
          "exposure": "public"
        }
      }
    }
  },
  "workloads": {},
  "security_rules": {},
  "secrets": {}
}
